{
  "slug": "qwen-mm-plugins",
  "name": "Qwen MM-Plugins",
  "nameZh": "Qwen 多模态插件集",
  "description": "Qwen 模型的原生多模态插件集：让任何 AI 智能体具备多模态能力。包含 8 个独立能力模块（Core/API/Search/Video-Memory/Video-Edit/Blender/FreeCAD/Edu-Agent），每个模块以 skill + MCP server 形式安装。",
  "descriptionEn": "Native multimodal plugins for Qwen models — make any AI agent harness multimodal-native. Ships 8 independent capability modules (Core/API/Search/Video-Memory/Video-Edit/Blender/FreeCAD/Edu-Agent), each installed as a skill + optional MCP server.",
  "descriptionJa": "Qwen モデル向けネイティブマルチモーダルプラグイン集。あらゆるAIエージェントをマルチモーダル対応に。8つの独立モジュール（Core/API/Search/Video-Memory/Video-Edit/Blender/FreeCAD/Edu-Agent）を提供。各モジュールはスキル＋オプションのMCPサーバーとしてインストール。",
  "descriptionEs": "Conjunto de plugins multimodales nativos para modelos Qwen — haz que cualquier agente IA aproveche la multimodalidad nativa. Incluye 8 módulos independientes (Core/API/Search/Video-Memory/Video-Edit/Blender/FreeCAD/Edu-Agent), cada uno instalable como skill + servidor MCP opcional.",
  "descriptionFr": "Ensemble de plugins multimodaux natifs pour les modèles Qwen — donnez à n'importe quel agent IA des capacités multimodales natives. 8 modules indépendants (Core/API/Search/Video-Memory/Video-Edit/Blender/FreeCAD/Edu-Agent), chacun installé comme un skill + serveur MCP optionnel.",
  "developer": "QwenLM (Alibaba Cloud)",
  "developerZh": "QwenLM（阿里云）",
  "repo": "QwenLM/Qwen-MM-Plugins",
  "agents": [
    "claude-code",
    "codex",
    "qoder",
    "openclaw",
    "qwen-code",
    "gemini-cli",
    "generic"
  ],
  "category": "Developer",
  "tags": [
    "Free",
    "Open Source"
  ],
  "installCommand": "curl -fsSL https://raw.githubusercontent.com/QwenLM/Qwen-MM-Plugins/main/install.sh | bash",
  "logo": "/logos/skills/qwen-mm-plugins.png",
  "stars": 2803,
  "featured": false,
  "faqs": [
    {
      "question": {
        "zh": "Qwen MM-Plugins 是什么？",
        "en": "What is Qwen MM-Plugins?",
        "ja": "Qwen MM-Plugins とは何ですか？",
        "es": "¿Qué es Qwen MM-Plugins?",
        "fr": "Qu'est-ce que Qwen MM-Plugins ?"
      },
      "answer": {
        "zh": "它是阿里云 QwenLM 团队开源的 Qwen 模型多模态插件集，包含 8 个独立能力模块：Core（本地 I/O，读写图片/视频/文档）、API（云端媒体理解，VL/Omni A/V/ASR/分割）、Search（网络搜索+反向图片搜索）、Video-Memory（长视频记忆图谱）、Video-Edit（视频编辑与生成）、Blender（Blender 3D 建模）、FreeCAD（参数化 CAD）、Edu-Agent（数学/科学教学视频生成）。每个模块以 skill + 可选 MCP server 形式安装，通过一个引导脚本即可完成部署。",
        "en": "It is an open-source multimodal plugin collection for Qwen models by Alibaba Cloud's QwenLM team, with 8 independent capability modules: Core (local I/O: read images/video/docs), API (cloud media understanding: VL/Omni A/V/ASR/segmentation), Search (web + reverse image search), Video-Memory (long-video hierarchical graph memory), Video-Edit (video editing and generation), Blender (3D modeling), FreeCAD (parametric CAD), and Edu-Agent (math/science tutorial video generation). Each module is installed as a skill + optional MCP server via a single guided installer script.",
        "ja": "Alibaba Cloud の QwenLM チームが公開した Qwen モデル向けのオープンソースマルチモーダルプラグイン集です。8つの独立モジュールを提供：Core（ローカルI/O）、API（クラウドメディア理解）、Search（Web検索＋画像逆引き）、Video-Memory（長編動画階層グラフメモリ）、Video-Edit（動画編集・生成）、Blender（3Dモデリング）、FreeCAD（パラメトリックCAD）、Edu-Agent（数学・科学の教育動画生成）。各モジュールはスキル＋オプションのMCPサーバーとして、単一のインストールスクリプトで導入可能。",
        "es": "Es un conjunto de plugins multimodales de código abierto para modelos Qwen, del equipo QwenLM de Alibaba Cloud, con 8 módulos independientes: Core (I/O local), API (comprensión de medios en la nube), Search (búsqueda web + imágenes inversa), Video-Memory (memoria jerárquica de video largo), Video-Edit (edición y generación de video), Blender (modelado 3D), FreeCAD (CAD paramétrico) y Edu-Agent (generación de videos educativos). Cada módulo se instala como skill + servidor MCP opcional mediante un único script de instalación.",
        "fr": "C'est une collection de plugins multimodaux open source pour les modèles Qwen, par l'équipe QwenLM d'Alibaba Cloud, avec 8 modules indépendants : Core (I/O local), API (compréhension multimédia cloud), Search (recherche web + image inversée), Video-Memory (mémoire hiérarchique pour vidéos longues), Video-Edit (montage et génération vidéo), Blender (modélisation 3D), FreeCAD (CAO paramétrique) et Edu-Agent (génération de vidéos éducatives). Chaque module s'installe comme un skill + serveur MCP optionnel via un script d'installation unique."
      }
    },
    {
      "question": {
        "zh": "怎么安装？",
        "en": "How do I install it?",
        "ja": "インストール方法は？",
        "es": "¿Cómo se instala?",
        "fr": "Comment l'installer ?"
      },
      "answer": {
        "zh": "一条命令即可安装：curl -fsSL https://raw.githubusercontent.com/QwenLM/Qwen-MM-Plugins/main/install.sh | bash。安装脚本会自动处理所有受支持的智能体（Claude Code、Codex、Qoder、OpenClaw、Qwen Code、Gemini CLI）。Windows 用户需使用 WSL2。也可以手动安装：先添加插件市场（claude plugin marketplace add 等），然后逐个安装能力模块。",
        "en": "One command: curl -fsSL https://raw.githubusercontent.com/QwenLM/Qwen-MM-Plugins/main/install.sh | bash. The installer handles all supported harnesses (Claude Code, Codex, Qoder, OpenClaw, Qwen Code, Gemini CLI) automatically. Windows users need WSL2. Alternatively, install manually: add the plugin marketplace, then install each capability module individually.",
        "ja": "1コマンドでインストール：curl -fsSL https://raw.githubusercontent.com/QwenLM/Qwen-MM-Plugins/main/install.sh | bash。対応する全ハーネス（Claude Code、Codex、Qoder、OpenClaw、Qwen Code、Gemini CLI）を自動処理。Windows ユーザーは WSL2 が必要。手動インストールも可能：プラグインマーケットを追加後、各モジュールを個別にインストール。",
        "es": "Un solo comando: curl -fsSL https://raw.githubusercontent.com/QwenLM/Qwen-MM-Plugins/main/install.sh | bash. El instalador maneja todos los harnesses compatibles (Claude Code, Codex, Qoder, OpenClaw, Qwen Code, Gemini CLI) automáticamente. Usuarios de Windows necesitan WSL2. Instalación manual también disponible.",
        "fr": "Une seule commande : curl -fsSL https://raw.githubusercontent.com/QwenLM/Qwen-MM-Plugins/main/install.sh | bash. L'installeur prend en charge tous les harnesses compatibles (Claude Code, Codex, Qoder, OpenClaw, Qwen Code, Gemini CLI) automatiquement. Les utilisateurs Windows ont besoin de WSL2. Installation manuelle également possible."
      }
    },
    {
      "question": {
        "zh": "免费吗？支持哪些能力？",
        "en": "Is it free? What capabilities does it support?",
        "ja": "無料ですか？どのような機能がありますか？",
        "es": "¿Es gratuito? ¿Qué capacidades tiene?",
        "fr": "Est-ce gratuit ? Quelles capacités prend-il en charge ?"
      },
      "answer": {
        "zh": "完全免费开源（Apache 2.0 协议）。8 个能力模块覆盖：本地多模态文件读写（Core）、云端 API 媒体理解（VL/Omni A/V/ASR 等）、网络搜索与反向图片搜索（Search）、长视频记忆问答（Video-Memory）、视频编辑与生成（Video-Edit）、Blender 3D 建模与渲染（Blender）、FreeCAD 参数化 CAD 设计（FreeCAD）、数学/科学教学视频自动生成（Edu-Agent）。部分能力（如 API 模块）需要 DashScope 等云服务 API key。",
        "en": "Completely free and open source (Apache 2.0). 8 capability modules cover: local multimodal file I/O (Core), cloud API media understanding (VL/Omni A/V/ASR etc.), web + reverse image search (Search), long-video memory QA (Video-Memory), video editing and generation (Video-Edit), Blender 3D modeling and rendering (Blender), FreeCAD parametric CAD design (FreeCAD), and math/science tutorial video generation (Edu-Agent). Some capabilities (e.g. API module) require a cloud service API key like DashScope.",
        "ja": "完全無料のオープンソース（Apache 2.0）。8つのモジュール：ローカルマルチモーダルファイルI/O（Core）、クラウドAPIメディア理解（VL/Omni A/V/ASR等）、Web検索＋画像逆引き（Search）、長編動画記憶QA（Video-Memory）、動画編集・生成（Video-Edit）、Blender 3Dモデリング・レンダリング（Blender）、FreeCADパラメトリックCAD設計（FreeCAD）、数学・科学教育動画生成（Edu-Agent）。一部の機能（APIモジュールなど）は DashScope 等のAPIキーが必要。",
        "es": "Completamente gratuito y de código abierto (Apache 2.0). 8 módulos: I/O multimodal local (Core), comprensión de medios por API cloud (VL/Omni A/V/ASR etc.), búsqueda web + imágenes inversa (Search), QA de memoria de video largo (Video-Memory), edición y generación de video (Video-Edit), modelado 3D Blender (Blender), CAD paramétrico FreeCAD (FreeCAD), y generación de videos educativos (Edu-Agent). Algunos módulos requieren clave API de servicios cloud como DashScope.",
        "fr": "Entièrement gratuit et open source (Apache 2.0). 8 modules : I/O multimodale locale (Core), compréhension média par API cloud (VL/Omni A/V/ASR etc.), recherche web + image inversée (Search), QA mémoire vidéo longue (Video-Memory), montage et génération vidéo (Video-Edit), modélisation 3D Blender (Blender), CAO paramétrique FreeCAD (FreeCAD), et génération de vidéos éducatives (Edu-Agent). Certains modules nécessitent une clé API de services cloud comme DashScope."
      }
    }
  ]
}
