{
  "slug": "huashu-design",
  "name": "Huashu Design",
  "nameZh": "Huashu Design",
  "description": "生成 HTML、原型、可编辑 PPT、动画，以 HTML 为中心的创意设计",
  "descriptionEn": "Generate HTML, prototypes, editable PPTs, animations",
  "descriptionJa": "HTML、プロトタイプ、編集可能なPPT、アニメーションを生成",
  "descriptionEs": "Genera HTML, prototipos, PPT editables, animaciones",
  "descriptionFr": "G?n?rez HTML, prototypes, PPT modifiables, animations",
  "developer": "alchaincyf",
  "developerZh": "alchaincyf",
  "repo": "alchaincyf/huashu-design",
  "agents": [
    "claude",
    "cursor",
    "codex",
    "generic"
  ],
  "category": "Design",
  "tags": [
    "Free",
    "Open Source"
  ],
  "installCommand": "npx skills add alchaincyf/huashu-design",
  "logo": "/logos/skills/huashu-design.png",
  "stars": 23883,
  "featured": false,
  "faqs": [
    {
      "question": {
        "en": "How do I install this skill?",
        "zh": "如何安装这个技能？",
        "ja": "このスキルをインストールするには？",
        "es": "?C?mo instalo este skill?",
        "fr": "Comment installer ce skill ?"
      },
      "answer": {
        "en": "Run the install command in your agent terminal.",
        "zh": "在智能体的终端中运行安装命令。",
        "ja": "エージェントのターミナルでインストールコマンドを実行します。",
        "es": "Ejecuta el comando de instalaci?n en la terminal de tu agente.",
        "fr": "Exécutez la commande d'installation dans le terminal de votre agent."
      }
    },
    {
      "question": {
        "en": "Which agents support this skill?",
        "zh": "哪些智能体支持这个技能？",
        "ja": "どのエージェントがこのスキルをサポートしていますか？",
        "es": "?Qu? agentes son compatibles con este skill?",
        "fr": "Quels agents supportent ce skill ?"
      },
      "answer": {
        "en": "Claude Code, Cursor, Codex, and other MCP-compatible agents.",
        "zh": "Claude Code銆丆ursor銆丆odex 和其他 MCP 兼容的智能体。",
        "ja": "Claude Code銆丆ursor銆丆odex銆佷お傛ひその他のMCP互換エージェント銆?",
        "es": "Claude Code, Cursor, Codex y otros agentes compatibles con MCP.",
        "fr": "Claude Code, Cursor, Codex et autres agents compatibles MCP."
      }
    },
    {
      "question": {
        "en": "Is this skill free?",
        "zh": "这个技能免费吗？",
        "ja": "このスキルは無料ですか？",
        "es": "?Este skill es gratuito?",
        "fr": "Ce skill est-il gratuit ?"
      },
      "answer": {
        "en": "Yes, it is free and open source.",
        "zh": "是的，免费且开源。",
        "ja": "はい、無料でオープンソースです。",
        "es": "S?, es gratuito y de c?digo abierto.",
        "fr": "Oui, il est gratuit et open source."
      }
    }
  ]
}
