{
  "slug": "taste-skill",
  "name": "Taste-Skill",
  "nameZh": "Taste-Skill",
  "description": "给你的 AI 赋予好品味——不再生成无聊、千篇一律的前端和 UI 设计。",
  "descriptionEn": "Gives your AI good taste. Stops the AI from generating boring, generic slop for frontend and UI design.",
  "descriptionJa": "AIに良いセンスを与えます。退屈で一般的なフロントエンド/UIデザインを生成するのを防ぎます。",
  "descriptionEs": "Dale buen gusto a tu IA. Evita que genere slop aburrido y genérico para frontend y UI.",
  "descriptionFr": "Donne du bon goût à votre IA. Empêche de générer du slop ennuyeux et générique pour le frontend et UI.",
  "repo": "Leonxlnx/taste-skill",
  "category": "Design",
  "tags": [
    "Free",
    "Open Source"
  ],
  "featured": false,
  "agents": [
    "codex",
    "claude-code"
  ],
  "stars": 84598,
  "developer": "Leonxlnx",
  "developerZh": "Leonxlnx",
  "installCommand": "npm i -g taste-skill",
  "logo": "/logos/skills/taste-skill.png",
  "faqs": [
    {
      "question": {
        "en": "What is Taste-Skill?",
        "zh": "什么是 Taste-Skill？",
        "ja": "Taste-Skillとは？",
        "es": "¿Qué es Taste-Skill?",
        "fr": "Qu'est-ce que Taste-Skill?"
      },
      "answer": {
        "en": "A skill that gives your AI good taste in frontend and UI design, preventing boring and generic output.",
        "zh": "一个让 AI 在前端和 UI 设计方面具备良好品味的技能，防止生成乏味和通用的输出。",
        "ja": "AIにフロントエンドとUIデザインの良いセンスを与え、退屈で一般的な出力を防ぐスキル。",
        "es": "Una habilidad que le da a tu IA buen gusto en diseño frontend y UI, evitando resultados aburridos y genéricos.",
        "fr": "Une compétence qui donne à votre IA du bon goût en design frontend et UI, évitant les sorties ennuyeuses et génériques."
      }
    },
    {
      "question": {
        "en": "Which agents does it work with?",
        "zh": "兼容哪些智能体？",
        "ja": "どのエージェントと連携できますか？",
        "es": "¿Con qué agentes funciona?",
        "fr": "Avec quels agents fonctionne-t-il?"
      },
      "answer": {
        "en": "Works with Claude Code, Codex, and other major AI coding agents.",
        "zh": "兼容 Claude Code、Codex 等主流 AI 编码智能体。",
        "ja": "Claude Code、Codex、その他の主要なAIコーディングエージェントと連携します。",
        "es": "Funciona con Claude Code, Codex y otros agentes de codificación de IA principales.",
        "fr": "Fonctionne avec Claude Code, Codex et autres agents de codage IA majeurs."
      }
    },
    {
      "question": {
        "en": "How to install?",
        "zh": "如何安装？",
        "ja": "インストール方法は？",
        "es": "¿Cómo instalar?",
        "fr": "Comment installer?"
      },
      "answer": {
        "en": "Run: npm i -g taste-skill",
        "zh": "运行：npm i -g taste-skill",
        "ja": "実行：npm i -g taste-skill",
        "es": "Ejecuta: npm i -g taste-skill",
        "fr": "Exécutez: npm i -g taste-skill"
      }
    }
  ]
}
