{
  "slug": "tencentdb-agent-memory",
  "name": "TencentDB Agent Memory",
  "nameZh": "腾讯云数据库 Agent Memory",
  "description": "团队级 AI Agent 记忆中枢：把对话、文档、代码沉淀为四种可复用记忆资产（对话记忆、技能、LLM Wiki、代码图谱），支持跨 Agent 框架治理与共享。支持 OpenClaw、Hermes、Claude Code、CodeBuddy 等。",
  "descriptionEn": "A team-level memory hub for AI Agents — turning conversations, docs, and code into four reusable memory assets (Chat Memory, Skill, LLM-Wiki, Code-Graph) that are governed, shared, and equipped across agents and frameworks. Supports OpenClaw, Hermes, Claude Code, CodeBuddy and more.",
  "descriptionJa": "チームレベルのAIエージェント記憶ハブ。会話・ドキュメント・コードを4つの再利用可能な記憶資産（チャット記憶、スキル、LLM Wiki、コードグラフ）に変え、エージェントやフレームワークをまたいで管理・共有できます。OpenClaw、Hermes、Claude Code、CodeBuddy などに対応。",
  "descriptionEs": "Un centro de memoria a nivel de equipo para agentes de IA: convierte conversaciones, documentos y código en cuatro activos de memoria reutilizables (Memoria de Chat, Skill, LLM-Wiki, Code-Graph) gestionados y compartidos entre agentes y frameworks. Compatible con OpenClaw, Hermes, Claude Code, CodeBuddy y más.",
  "descriptionFr": "Un hub de mémoire au niveau de l'équipe pour les agents IA : il transforme conversations, documents et code en quatre actifs de mémoire réutilisables (Mémoire de chat, Skill, LLM-Wiki, Code-Graph), gouvernés et partagés entre agents et frameworks. Compatible avec OpenClaw, Hermes, Claude Code, CodeBuddy et plus.",
  "developer": "Tencent Cloud",
  "developerZh": "腾讯云",
  "repo": "TencentCloud/TencentDB-Agent-Memory",
  "agents": [
    "openclaw",
    "hermes",
    "claude-code",
    "codebuddy",
    "generic"
  ],
  "category": "Developer",
  "tags": [
    "Open Source",
    "Free"
  ],
  "installCommand": "git clone https://github.com/TencentCloud/TencentDB-Agent-Memory.git && cd TencentDB-Agent-Memory/deploy/global-images && cp .env.example .env && ./start-all.sh",
  "logo": "/logos/skills/tencentdb-agent-memory.png",
  "stars": 25922,
  "featured": false,
  "faqs": [
    {
      "question": {
        "zh": "TencentDB Agent Memory 是什么？",
        "en": "What is TencentDB Agent Memory?",
        "ja": "TencentDB Agent Memory とは何ですか？",
        "es": "¿Qué es TencentDB Agent Memory?",
        "fr": "Qu'est-ce que TencentDB Agent Memory ?"
      },
      "answer": {
        "zh": "它是腾讯云开源的团队级 Agent 记忆中枢。核心思路：已经解释过的项目背景、读过的文档、跑通的流程，不该让每个 Agent 从零再来一遍。它把对话、文档、代码自动提炼为四种记忆资产——对话记忆（L0-L3 分层蒸馏）、技能库、LLM Wiki（文档知识图谱）、代码图谱——并通过 Memory Hub 统一管理、按权限共享给团队中的各个 Agent。",
        "en": "It is Tencent Cloud's open-source team-level memory hub for AI Agents. The core idea: project context already explained, documents already read, and workflows already proven should not be re-discovered from scratch by every agent. It distills conversations, docs, and code into four memory assets — Chat Memory (L0-L3 layered distillation), a Skill library, LLM Wiki (document knowledge graph), and CodeGraph — managed by a Memory Hub and shared with team agents under permission control.",
        "ja": "Tencent Cloud が公開した、チームレベルの AI エージェント記憶ハブです。考え方はシンプル：説明済みのプロジェクト背景、読み終えたドキュメント、確立したワークフローを、各エージェントがゼロから再発見する必要はない。会話・ドキュメント・コードを4つの記憶資産（L0〜L3の階層蒸留によるチャット記憶、スキルライブラリ、LLM Wiki、コードグラフ）に自動的に精製し、Memory Hub で一元管理し、権限制御のもとチームのエージェントと共有します。",
        "es": "Es el hub de memoria a nivel de equipo de código abierto de Tencent Cloud para agentes de IA. La idea central: el contexto de un proyecto ya explicado, los documentos ya leídos y los flujos ya probados no deberían redescubrirse desde cero por cada agente. Destila conversaciones, documentos y código en cuatro activos de memoria — Memoria de Chat (destilación en capas L0-L3), biblioteca de Skills, LLM Wiki (grafo de conocimiento de documentos) y CodeGraph — gestionados por un Memory Hub y compartidos con los agentes del equipo bajo control de permisos.",
        "fr": "C'est le hub de mémoire open source au niveau de l'équipe de Tencent Cloud pour les agents IA. L'idée centrale : le contexte d'un projet déjà expliqué, les documents déjà lus et les workflows déjà validés ne devraient pas être redécouverts depuis zéro par chaque agent. Il distille conversations, documents et code en quatre actifs de mémoire — Mémoire de chat (distillation en couches L0-L3), bibliothèque de Skills, LLM Wiki (graphe de connaissances documentaires) et CodeGraph — gérés par un Memory Hub et partagés avec les agents de l'équipe sous contrôle des permissions."
      }
    },
    {
      "question": {
        "zh": "怎么安装和部署？",
        "en": "How do I install and deploy it?",
        "ja": "インストールとデプロイ方法は？",
        "es": "¿Cómo se instala y despliega?",
        "fr": "Comment l'installer et le déployer ?"
      },
      "answer": {
        "zh": "一条命令拉起完整三件套（memory-core + memory-hub + proxy）：git clone 仓库后进入 deploy/global-images 目录，复制 .env.example 为 .env 并填入两组 LLM 参数，然后运行 ./start-all.sh。启动完成后它会打印一行可直接粘贴到 Claude Code 的配置命令，管理面板在 http://localhost:8125。完整安装文档见 INSTALL_CN.md。",
        "en": "One command brings up the full trio (memory-core + memory-hub + proxy): clone the repo, enter deploy/global-images, copy .env.example to .env and fill in two sets of LLM parameters, then run ./start-all.sh. When finished it prints a one-liner you can paste directly into Claude Code; the management panel is at http://localhost:8125. Full docs in INSTALL.md.",
        "ja": "1コマンドで完全な3点セット（memory-core + memory-hub + proxy）を起動できます：リポジトリをクローンし、deploy/global-images に入り、.env.example を .env にコピーして2組のLLMパラメータを入力し、./start-all.sh を実行するだけ。起動完了時に Claude Code にそのまま貼り付けられる一行コマンドが表示され、管理パネルは http://localhost:8125 です。完全なドキュメントは INSTALL.md（日本語訳は INSTALL_CN.md 相当）を参照。",
        "es": "Un solo comando levanta el trío completo (memory-core + memory-hub + proxy): clona el repositorio, entra en deploy/global-images, copia .env.example a .env y rellena dos conjuntos de parámetros LLM, luego ejecuta ./start-all.sh. Al terminar imprime una línea que puedes pegar directamente en Claude Code; el panel de gestión está en http://localhost:8125. Documentación completa en INSTALL.md.",
        "fr": "Une seule commande démarre le trio complet (memory-core + memory-hub + proxy) : clonez le dépôt, entrez dans deploy/global-images, copiez .env.example vers .env et remplissez deux ensembles de paramètres LLM, puis exécutez ./start-all.sh. À la fin, il affiche une ligne à coller directement dans Claude Code ; le panneau d'administration est sur http://localhost:8125. Documentation complète dans INSTALL.md."
      }
    },
    {
      "question": {
        "zh": "免费吗？支持哪些 Agent 框架？",
        "en": "Is it free? Which agent frameworks are supported?",
        "ja": "無料ですか？対応エージェントフレームワークは？",
        "es": "¿Es gratuito? ¿Qué frameworks de agentes soporta?",
        "fr": "Est-ce gratuit ? Quels frameworks d'agents sont pris en charge ?"
      },
      "answer": {
        "zh": "完全免费开源（MIT 协议）。目前官方支持 OpenClaw、Hermes、Claude Code、CodeBuddy 以及 SDK 集成，跨框架迁移在路线图中。安全性设计上：新的对话记忆和技能默认私有，共享是显式行为而非默认泄露，提供 private / team / restricted / agent 四层可见性。",
        "en": "Completely free and open source (MIT). Officially supports OpenClaw, Hermes, Claude Code, CodeBuddy and SDK integration; broader cross-framework migration is on the roadmap. Privacy by design: new Chat Memory and Skills are private by default, sharing is an explicit action — visibility levels span private / team / restricted / agent.",
        "ja": "完全無料のオープンソース（MITライセンス）です。現在は OpenClaw、Hermes、Claude Code、CodeBuddy、SDK統合を公式サポートし、より広いクロスフレームワーク移行はロードマップにあります。設計上のプライバシー：新しいチャット記憶とスキルはデフォルトでプライベート、共有は明示的な操作であり、private / team / restricted / agent の4段階の可視性があります。",
        "es": "Completamente gratuito y de código abierto (MIT). Soporta oficialmente OpenClaw, Hermes, Claude Code, CodeBuddy e integración SDK; la migración entre frameworks más amplia está en el roadmap. Privacidad por diseño: las nuevas Memorias de Chat y Skills son privadas por defecto; compartir es una acción explícita — con niveles de visibilidad private / team / restricted / agent.",
        "fr": "Entièrement gratuit et open source (licence MIT). Prend officiellement en charge OpenClaw, Hermes, Claude Code, CodeBuddy et l'intégration SDK ; une migration inter-frameworks plus large est sur la feuille de route. Confidentialité par conception : les nouvelles mémoires de chat et skills sont privées par défaut, le partage est une action explicite — avec des niveaux de visibilité private / team / restricted / agent."
      }
    }
  ]
}
