{
  "slug": "generative-media-skills",
  "name": "Generative Media Skills",
  "nameZh": "Generative Media Skills",
  "description": "图片、视频、音频生成工作流，一站式多模态内容创作",
  "descriptionEn": "Image, video, and audio generation workflow - all-in-one multimodal content creation",
  "descriptionJa": "画像、動画、音声生成ワークフロー - オールインワンのマルチモーダルコンテンツ制作",
  "descriptionEs": "Flujo de trabajo de generación de imágenes, video y audio - creación de contenido multimodal todo-en-uno",
  "descriptionFr": "Flux de travail de génération d'images, vidéo et audio - création de contenu multimodale tout-en-un",
  "developer": "Community",
  "developerZh": "社区",
  "repo": "SamurAIGPT/Generative-Media-Skills",
  "agents": [
    "claude",
    "cursor",
    "codex",
    "generic"
  ],
  "category": "Design",
  "tags": [
    "Free",
    "Open Source"
  ],
  "installCommand": "git clone https://github.com/SamurAIGPT/Generative-Media-Skills.git && cd Generative-Media-Skills",
  "logo": "/logos/skills/generative-media-skills.png",
  "stars": 4222,
  "featured": false,
  "faqs": [
    {
      "question": {
        "en": "How do I install this skill?",
        "zh": "如何安装这个技能？",
        "ja": "このスキルをインストールするには？",
        "es": "¿Cómo instalo este skill?",
        "fr": "Comment installer ce skill ?"
      },
      "answer": {
        "en": "Run the install command in your agent terminal.",
        "zh": "在智能体的终端中运行安装命令。",
        "ja": "エージェントのターミナルでインストールコマンドを実行します。",
        "es": "Ejecuta el comando de instalación en la terminal de tu agente.",
        "fr": "Exécutez la commande d'installation dans le terminal de votre agent."
      }
    },
    {
      "question": {
        "en": "Which agents support this skill?",
        "zh": "哪些智能体支持这个技能？",
        "ja": "どのエージェントがこのスキルをサポートしていますか？",
        "es": "¿Qué agentes son compatibles con este skill?",
        "fr": "Quels agents supportent ce skill ?"
      },
      "answer": {
        "en": "Claude Code, Cursor, Codex, and other MCP-compatible agents.",
        "zh": "Claude Code、Cursor、Codex 和其他 MCP 兼容的智能体。",
        "ja": "Claude Code、Cursor、Codex、およびその他のMCP互換エージェント。",
        "es": "Claude Code, Cursor, Codex y otros agentes compatibles con MCP.",
        "fr": "Claude Code, Cursor, Codex et autres agents compatibles MCP."
      }
    },
    {
      "question": {
        "en": "Is this skill free?",
        "zh": "这个技能免费吗？",
        "ja": "このスキルは無料ですか？",
        "es": "¿Este skill es gratuito?",
        "fr": "Ce skill est-il gratuit ?"
      },
      "answer": {
        "en": "Yes, it is free and open source.",
        "zh": "是的，免费且开源。",
        "ja": "はい、無料でオープンソースです。",
        "es": "Sí, es gratuito y de código abierto.",
        "fr": "Oui, il est gratuit et open source."
      }
    }
  ]
}
