{
  "slug": "gc-minimal-zine-poster",
  "name": "GC Minimal Zine Poster",
  "nameZh": "GC 极简杂志海报",
  "description": "Codex 技能：把一个主题、句子、文章想法、物品、情绪、照片或参考集转化为极简纸纹理编辑海报、可生产的图像提示或可复用的视觉系统。",
  "descriptionEn": "A Codex skill for turning a theme, sentence, article idea, object, mood, photograph, or reference set into a sparse paper-texture editorial poster, a production-ready image prompt, or a reusable visual system.",
  "descriptionJa": "Codexスキル：テーマ、文章、アイデア、オブジェクト、ムード、写真、リファレンスセットを、ミニマルな紙質エディトリアルポスター、プロダクション対応の画像プロンプト、または再利用可能なビジュアルシステムに変換。",
  "descriptionEs": "Un skill de Codex para convertir un tema, frase, idea de artículo, objeto, estado de ánimo, fotografía o conjunto de referencias en un póster editorial de textura de papel minimalista, un prompt de imagen listo para producción o un sistema visual reutilizable.",
  "descriptionFr": "Un skill Codex pour transformer un thème, une phrase, une idée d'article, un objet, une humeur, une photographie ou un ensemble de références en une affiche éditoriale minimaliste à texture papier, un prompt d'image prêt pour la production ou un système visuel réutilisable.",
  "developer": "LiamGvchi",
  "developerZh": "LiamGvchi",
  "repo": "LiamGvchi/gc-minimal-zine-poster",
  "agents": [
    "codex",
    "claude-code",
    "cursor",
    "generic"
  ],
  "category": "Design",
  "tags": [
    "Free",
    "Open Source"
  ],
  "installCommand": "Add to your Codex skill directory or use the Codex plugin marketplace. See README for details.",
  "logo": "/logos/skills/gc-minimal-zine-poster.png",
  "stars": 6920,
  "featured": false,
  "faqs": [
    {
      "question": {
        "zh": "GC Minimal Zine Poster 是什么？",
        "en": "What is GC Minimal Zine Poster?",
        "ja": "GC Minimal Zine Poster とは？",
        "es": "¿Qué es GC Minimal Zine Poster?",
        "fr": "Qu'est-ce que GC Minimal Zine Poster ?"
      },
      "answer": {
        "zh": "它是一个 Codex 技能，能把任何主题、句子、想法或照片转化为极简纸纹理编辑海报。支持生成、参考分析、纯提示词和综合分析四种模式，输出 3:5 比例的竖版纸纹理海报，70-90% 留白，日韩 indie 杂志风格。",
        "en": "It's a Codex skill that turns any theme, sentence, idea, or photo into a sparse paper-texture editorial poster. Supports Generate, Reference Analysis, Prompt-only, and Analyze+Generate modes, outputting 3:5 vertical paper posters with 70-90% negative space in a Japanese/Korean indie-zine aesthetic.",
        "ja": "Codexスキルで、テーマ、文章、アイデア、写真をミニマルな紙質エディトリアルポスターに変換。生成、参考分析、プロンプトのみ、分析+生成の4モードに対応。3:5の縦型紙質ポスター、70-90%の余白、日韓インディーズ雑誌スタイル。",
        "es": "Es un skill de Codex que convierte cualquier tema, frase, idea o foto en un póster editorial de textura de papel minimalista. Compatible con modos Generar, Análisis de Referencia, Solo Prompt y Analizar+Generar, con pósters verticales 3:5, 70-90% de espacio negativo, estilo indie japonés/coreano.",
        "fr": "C'est un skill Codex qui transforme n'importe quel thème, phrase, idée ou photo en une affiche éditoriale minimaliste à texture papier. Prend en charge les modes Générer, Analyse de Référence, Prompt uniquement et Analyser+Générer, avec des affiches verticales 3:5, 70-90% d'espace négatif, style indie japonais/coréen."
      }
    },
    {
      "question": {
        "zh": "怎么安装？",
        "en": "How to install?",
        "ja": "インストール方法は？",
        "es": "¿Cómo instalar?",
        "fr": "Comment installer ?"
      },
      "answer": {
        "zh": "克隆仓库到你的 Codex 技能目录，或通过 Codex 插件市场添加。需要 Codex 桌面端 v1.5+。技能名为 gc-minimal-zine-poster-v0-3。",
        "en": "Clone the repo to your Codex skill directory, or add via the Codex plugin marketplace. Requires Codex desktop v1.5+. The skill name is gc-minimal-zine-poster-v0-3.",
        "ja": "リポジトリをCodexスキルディレクトリにクローンするか、Codexプラグインマーケットから追加。Codexデスクトップv1.5+が必要。スキル名は gc-minimal-zine-poster-v0-3。",
        "es": "Clona el repositorio en tu directorio de skills de Codex, o añádelo via el marketplace de Codex. Requiere Codex desktop v1.5+. El nombre del skill es gc-minimal-zine-poster-v0-3.",
        "fr": "Clonez le dépôt dans votre répertoire de skills Codex, ou ajoutez via le marketplace Codex. Nécessite Codex desktop v1.5+. Le nom du skill est gc-minimal-zine-poster-v0-3."
      }
    },
    {
      "question": {
        "zh": "免费吗？",
        "en": "Is it free?",
        "ja": "無料ですか？",
        "es": "¿Es gratuito?",
        "fr": "Est-ce gratuit ?"
      },
      "answer": {
        "zh": "免费开源（MIT 协议）。",
        "en": "Free and open source (MIT).",
        "ja": "無料のオープンソース（MITライセンス）。",
        "es": "Gratuito y de código abierto (MIT).",
        "fr": "Gratuit et open source (licence MIT)."
      }
    }
  ]
}
